{
  "$schema": "http://json-schema.org/draft-07/schema#",
  "$id": "https://sceneverso.com/schemas/manifest.v1.schema.json",
  "title": "Video Factory Manifest",
  "description": "Declarative, human-reviewable source of truth for one video. The Director/Screenwriter agents SERIALIZE their creative work into this; it is reviewed by a human BEFORE any expensive generation call; then the Producer/Editor agents consume and UPDATE it in place as assets are produced. If output is wrong, fix the manifest, not the code.",
  "type": "object",
  "required": ["version", "title", "format", "scenes"],
  "additionalProperties": false,
  "properties": {
    "version": { "const": "1" },
    "title": {
      "type": "string",
      "description": "Human title / output filename stem."
    },
    "intent": {
      "type": "string",
      "description": "One sentence: who this is for and what it must achieve. Anchors every downstream judgment call."
    },
    "format": {
      "type": "array",
      "description": "Output aspect ratios to render. Each becomes its own MP4.",
      "items": { "enum": ["16:9", "9:16", "1:1"] },
      "minItems": 1
    },
    "fps": { "type": "integer", "default": 30, "minimum": 24, "maximum": 60 },
    "compositor": {
      "enum": ["remotion", "hyperframes"],
      "default": "remotion",
      "description": "Compositor engine to render the manifest."
    },
    "music": {
      "type": "string",
      "description": "Global background music asset path."
    },
    "brand": {
      "type": "object",
      "description": "Visual + sonic identity carried across every scene. Locks consistency (drift is the #1 slop signal).",
      "additionalProperties": false,
      "properties": {
        "palette": {
          "type": "array",
          "items": { "type": "string" },
          "description": "Hex colors."
        },
        "font": { "type": "string" },
        "lut": {
          "type": "string",
          "description": "Path to a .cube LUT applied to all generated clips before scene-specific correction."
        },
        "music_style": {
          "type": "string",
          "description": "Default music brief if a scene omits its own."
        },
        "tone": {
          "type": "string",
          "description": "e.g. 'calm authoritative', 'high-energy'. Drives TTS delivery + pacing."
        },
        "ref_lock": {
          "type": "boolean",
          "description": "Default ref_lock behavior across all scenes."
        }
      }
    },
    "hook": {
      "type": "object",
      "description": "The first 0-3s. 50-60% of drop-off happens here. MUST work muted (60%+ watch silent).",
      "additionalProperties": false,
      "properties": {
        "type": {
          "enum": [
            "bold_claim",
            "curiosity_gap",
            "micro_story",
            "visual_shock",
            "direct_question"
          ]
        },
        "text": {
          "type": "string",
          "description": "On-screen text that lands before the voiceover. Never a logo."
        }
      }
    },
    "scenes": {
      "type": "array",
      "minItems": 1,
      "items": { "$ref": "#/definitions/scene" }
    }
  },
  "definitions": {
    "scene": {
      "type": "object",
      "required": ["id", "tts_script", "visual"],
      "additionalProperties": false,
      "properties": {
        "id": {
          "type": "string",
          "description": "Stable unique id, e.g. 's1'. Asset filenames key off this."
        },
        "title": { "type": "string" },
        "tts_script": {
          "type": "string",
          "description": "EXACT narration. Source of truth for TIMING — scene duration is derived from real audio length, never estimated. Also the on-screen text and caption source. When `voiceover` is set, keep tts_script verbatim-equal to the spoken clip so captions and on-screen copy match."
        },
        "tts_phonetic": {
          "type": "string",
          "description": "Optional phonetic pronunciation string sent to the TTS voice engine. Enables ear vs eye decoupling: technical syntax stays in tts_script for on-screen typography/captions, while tts_phonetic ensures correct pronunciation (e.g. 'claud-dot-m-d')."
        },
        "voiceover": {
          "type": "string",
          "description": "Path to a SUPPLIED real-voice audio clip to use as this scene's narration instead of TTS — e.g. a speaker's actual voice pulled from a recording via `scripts/extract-voice.mjs`. The producer uses it as the scene audio, measures its real duration, and recovers caption word-timings via STT. Use for apex quotes where authentic delivery beats TTS."
        },
        "duration_estimate_s": {
          "type": "number",
          "description": "Planning estimate only; replaced by measured audio duration after TTS."
        },
        "duration_ms": {
          "type": "integer",
          "description": "Measured scene duration in milliseconds from real audio/media."
        },
        "_audio": {
          "type": "string",
          "description": "Path to generated/extracted scene narration audio."
        },
        "_sfx": {
          "type": "array",
          "items": { "type": "string" },
          "description": "Paths to generated scene sound effects."
        },
        "word_timings": {
          "type": "array",
          "items": {
            "type": "object",
            "required": ["word", "start_ms", "end_ms"],
            "properties": {
              "word": { "type": "string" },
              "start_ms": { "type": "number" },
              "end_ms": { "type": "number" }
            }
          },
          "description": "Word-level timestamp alignments for captions."
        },
        "visual": {
          "type": "object",
          "required": ["source"],
          "additionalProperties": false,
          "properties": {
            "source": {
              "enum": ["code", "image", "clip", "screen_rec", "avatar"],
              "description": "code = Remotion-animated (zero-key); image = generated still; clip = generative video; screen_rec = supplied recording; avatar = talking head."
            },
            "visual_brief": {
              "type": "string",
              "description": "SEMANTIC art direction, NOT a keyword. 'neurons firing across a dark synaptic gap', not 'brain'. The Editor scores the produced asset against this before committing it."
            },
            "asset": {
              "type": "string",
              "description": "Path to the produced/supplied asset (filled by the pipeline)."
            },
            "ref_lock": {
              "type": "boolean",
              "description": "Whether to lock generative video with an image still frame."
            },
            "overlay": {
              "type": "string",
              "description": "Optional overlay asset or badge."
            },
            "fit": {
              "enum": ["cover", "contain"],
              "default": "cover",
              "description": "For source=image: object-fit. 'cover' crops to fill (default for photos); 'contain' shows the whole asset on the brand background (use for portrait/poster art like a magazine cover so nothing is cropped)."
            },
            "objectPosition": {
              "type": "string",
              "description": "For source=image: CSS object-position (e.g. '68% 42%'). Biases the Ken-Burns crop so an off-centre subject survives a tighter aspect (e.g. keep a right-of-centre speaker in the 9:16 cut)."
            },
            "component": {
              "type": "string",
              "description": "For source=code: Remotion component name (e.g. 'TitleCard', 'StatCard', 'BeforeAfter')."
            },
            "props": {
              "type": "object",
              "description": "For source=code: props passed to the component."
            },
            "shot": {
              "type": "object",
              "description": "Encourages shot variety (>=3 types / 60s). Advisory to the generator.",
              "additionalProperties": false,
              "properties": {
                "size": { "enum": ["wide", "medium", "close"] },
                "angle": { "enum": ["eye", "low", "high"] },
                "motion": { "enum": ["static", "push", "handheld", "pan"] }
              }
            }
          }
        },
        "continuity_refs": {
          "type": "array",
          "items": { "type": "string" },
          "description": "Frame/asset paths from prior scenes to seed this scene's generation — carries character/look forward."
        },
        "captions": {
          "enum": ["auto", "none"],
          "default": "auto",
          "description": "auto = word-level animated captions from real STT timestamps."
        },
        "music_bed": {
          "type": "string",
          "description": "Music brief for this scene, or 'continue' to hold the prior track. Chapter changes should change the track."
        },
        "sfx": {
          "type": "array",
          "items": { "type": "string" },
          "description": "SFX briefs, e.g. 'soft whoosh on cut', 'impact hit on reveal'."
        },
        "provider_assignments": {
          "type": "object",
          "description": "Per-scene provider overrides. Omitted = skill defaults (providers/providers.json).",
          "additionalProperties": false,
          "properties": {
            "tts": { "type": "string" },
            "clip": { "type": "string" },
            "image": { "type": "string" },
            "music": { "type": "string" },
            "avatar": { "type": "string" }
          }
        },
        "quality_gate": {
          "type": "object",
          "description": "Hard gates checked before a scene is accepted. Failure triggers regeneration, not silent continuation.",
          "additionalProperties": false,
          "properties": {
            "min_semantic_score": {
              "type": "number",
              "default": 0.7,
              "description": "Editor's score (0-1) of the asset vs visual_brief."
            },
            "silence_max_ms": {
              "type": "integer",
              "default": 700,
              "description": "Max leading/trailing silence in the TTS audio (ffprobe)."
            },
            "speaking_rate_wpm": {
              "type": "array",
              "items": { "type": "number" },
              "default": [120, 180],
              "description": "Acceptable [min,max] words-per-minute window."
            }
          }
        }
      }
    }
  }
}
