{
  "version": "1",
  "title": "video-factory-demo",
  "intent": "Show, in 15 seconds, why Video Factory produces non-slop video — renders zero-key from code-animated scenes.",
  "format": ["16:9", "9:16"],
  "fps": 30,
  "brand": {
    "palette": ["#0b0b0f", "#ffd24a"],
    "font": "Inter, system-ui, sans-serif",
    "tone": "calm authoritative",
    "music_style": "warm lo-fi piano, restrained"
  },
  "hook": {
    "type": "bold_claim",
    "text": "Most AI video is slop. Watch what good looks like."
  },
  "scenes": [
    {
      "id": "s1",
      "title": "Hook",
      "tts_script": "Most AI video is generic. You forget it… before the next scroll.",
      "duration_estimate_s": 3,
      "visual": { "source": "code", "component": "TitleCard" }
    },
    {
      "id": "s2",
      "title": "The stat",
      "tts_script": "Fifty to sixty percent of viewers leave. In the first three seconds.",
      "duration_estimate_s": 4,
      "visual": {
        "source": "code",
        "component": "StatCard",
        "props": { "value": "3s", "label": "where most viewers leave" }
      }
    },
    {
      "id": "s3",
      "title": "The fix",
      "tts_script": "Video Factory writes a reviewable plan first. Then assembles every layer deliberately.",
      "duration_estimate_s": 5,
      "visual": { "source": "code", "component": "TitleCard" }
    },
    {
      "id": "s4",
      "title": "Close",
      "tts_script": "Video this good… made on purpose.",
      "duration_estimate_s": 3,
      "visual": { "source": "code", "component": "TitleCard" }
    }
  ]
}
